title,url,publishedDate,dateObject
"Assam Admits Protests Over Citizenship Bill A Challenge, Calls For Calm",https://www.ndtv.com/india-news/assam-admits-protests-over-citizenship-bill-a-challenge-calls-for-calm-1987411,03 Feb 2019,2019-02-03 00:00:00
Women Farmers Tie Up Hands In Symbolic Protest Near Delhi-Noida Flyway,https://www.ndtv.com/india-news/women-farmers-tie-up-hands-in-symbolic-protest-near-delhi-noida-flyway-1987374,02 Feb 2019,2019-02-02 00:00:00
Former Madhya Pradesh Police Chief Rishi Kumar Shukla Is New CBI Boss,https://www.ndtv.com/india-news/ips-rishi-kumar-shukla-appointed-new-cbi-director-1987358,03 Feb 2019,2019-02-03 00:00:00
BJP Faces Pushback From Northeast Allies Over Citizenship Bill,https://www.ndtv.com/india-news/bjp-faces-pushback-from-northeast-allies-over-citizenship-bill-1987226,02 Feb 2019,2019-02-02 00:00:00
Ex-RJD Lawmaker Mohammad Shahabuddin's Nephew Shot Dead In Bihar,https://www.ndtv.com/india-news/ex-rjd-lawmaker-mohammad-shahabuddins-nephew-mohammad-yusuf-shot-dead-in-bihars-siwan-1987190,02 Feb 2019,2019-02-02 00:00:00
"Traffic Resumes At DND Flyway, Shut Earlier Due To Farmers' Protest",https://www.ndtv.com/india-news/traffic-resumes-at-delhi-noida-direct-flyway-shut-earlier-due-to-farmers-protest-1987071,01 Feb 2019,2019-02-01 00:00:00
Indian Girl Students Fight To Stay Out After Dark: Foreign Media,https://www.ndtv.com/india-news/indian-girl-students-fight-to-stay-out-after-dark-foreign-media-1987029,01 Feb 2019,2019-02-01 00:00:00
3 Arrested For Nude Protest Outside Assam Secretariat Over Citizenship Bill,https://www.ndtv.com/india-news/3-stage-nude-protest-outside-assam-secretariat-over-citizenship-bill-1986978,01 Feb 2019,2019-02-01 00:00:00
Bandh Observed In Andhra Pradesh Over Special Category Status,https://www.ndtv.com/andhra-pradesh-news/bandh-observed-in-andhra-pradesh-over-special-category-status-1986857,01 Feb 2019,2019-02-01 00:00:00
"6 Indian Immigrant Detainees, On Hunger Strike, Force-Fed At US Centre",https://www.ndtv.com/indians-abroad/indians-on-hunger-strike-at-us-detention-centre-being-force-fed-1986850,01 Feb 2019,2019-02-01 00:00:00
Opposition Members Protest Amid Budget Presentation,https://www.ndtv.com/india-news/opposition-members-protest-amid-budget-presentation-1986726,01 Feb 2019,2019-02-01 00:00:00
"Budget 2019 Proposals Leaked, Allege Opposition Parties",https://www.ndtv.com/india-news/budget-2019-proposals-leaked-allege-opposition-parties-1986654,01 Feb 2019,2019-02-01 00:00:00
N Chandrababu Naidu Wears Black Shirt To Protest Against Centre,https://www.ndtv.com/andhra-pradesh-news/andhra-pradesh-chief-minister-n-chandrababu-naidu-wears-black-shirt-to-protest-against-centre-1986616,01 Feb 2019,2019-02-01 00:00:00
"NCP Leader Nawab Malik Targets Anna Hazare, Gets Sued For Defamation",https://www.ndtv.com/india-news/ncp-leader-nawab-malik-targets-anna-hazare-gets-sued-for-defamation-1986460,01 Feb 2019,2019-02-01 00:00:00
