title,url,publishedDate,dateObject
"Pondicherry University Administration Meets Protesting Students, Agitation Called Off",https://www.ndtv.com/education/pondicherry-university-administration-meets-protesting-students-agitation-called-off-2013486,27 Mar 2019,2019-03-27 00:00:00
JNU Students Continue Protest Against Introduction Of 'Expensive MBA Course',https://www.ndtv.com/education/jnu-protest-jawaharlal-nehru-university-students-continue-hunger-strike-2013482,27 Mar 2019,2019-03-27 00:00:00
Man Who Egged British Opposition Leader Jeremy Corbyn Jailed For 28 Days,https://www.ndtv.com/world-news/man-who-egged-british-opposition-leader-jeremy-corbyn-jailed-for-28-days-2012763,26 Mar 2019,2019-03-26 00:00:00
"Amid Row Over 'PhD On National Priorities' Order, Kerala Professor Quits",https://www.ndtv.com/kerala-news/amid-row-over-phd-on-national-priorities-order-kerala-professor-meena-pillai-quits-2012254,25 Mar 2019,2019-03-25 00:00:00
"""No Short Skirts"": Maharashtra College's Diktat Upsets Students",https://www.ndtv.com/mumbai-news/no-shorts-skirts-maharashtras-jj-hospitals-grant-medical-college-issues-diktat-to-students-2012156,24 Mar 2019,2019-03-24 00:00:00
Sushma Swaraj Has A Twitter Spat With Pak Minister Over Minorities,https://www.ndtv.com/india-news/sushma-swaraj-has-a-twitter-spat-with-pakistan-minister-over-minorities-fawad-hussain-2012056,24 Mar 2019,2019-03-24 00:00:00
Hundreds Of Thousands Protest In London To Demand New Brexit Vote,https://www.ndtv.com/world-news/hundreds-of-thousands-protest-in-london-to-demand-new-brexit-referendum-2011931,24 Mar 2019,2019-03-24 00:00:00
HD Deve Gowda To Contest Lok Sabha Polls From Karnataka's Tumakuru: Party,https://www.ndtv.com/india-news/hd-deve-gowda-tumkur-to-contest-lok-sabha-elections-2019-from-karnatakas-tumakuru-2011795,23 Mar 2019,2019-03-23 00:00:00
More Than 100 Tamil Nadu Farmers To Fight Polls Against PM From Varanasi,https://www.ndtv.com/india-news/lok-sabha-elections-2019-more-than-100-farmers-to-fight-polls-against-pm-narendra-modi-in-varanasi-2011770,23 Mar 2019,2019-03-23 00:00:00
"Italy Bus Hijacker ""Heard Voices"" Of Drowned Migrant Children: Report",https://www.ndtv.com/world-news/italy-bus-hijacker-heard-voices-of-drowned-migrant-children-report-2011576,23 Mar 2019,2019-03-23 00:00:00
Paris Police Ban 'Yellow Vest' Protests On Champs-Elysees On Saturday,https://www.ndtv.com/world-news/paris-police-ban-yellow-vest-protests-on-champs-elysees-on-saturday-2011466,22 Mar 2019,2019-03-22 00:00:00
"Amazon Employee Says He Was Fired for Calling for Unionisation, Safer Working Conditions",https://gadgets.ndtv.com/internet/news/amazon-employee-says-he-was-fired-for-calling-for-unionisation-safer-working-conditions-2011396,22 Mar 2019,2019-03-22 00:00:00
Sit-In By 200 Aspiring School Teachers Enters 22nd Day,https://www.ndtv.com/jobs/sit-in-by-200-aspiring-school-teachers-enters-22nd-day-2011086,22 Mar 2019,2019-03-22 00:00:00
Outraged Srinagar Protests Against Custodial Death Of School Principal,https://www.ndtv.com/india-news/outraged-srinagar-protests-against-custodial-death-of-school-principal-rizwan-asad-pandit-2010939,21 Mar 2019,2019-03-21 00:00:00
"Driver Hijacks, Sets School Bus On Fire In Italy, Children Escape Unhurt",https://www.ndtv.com/world-news/driver-in-italy-sets-school-bus-full-of-children-on-fire-2010570,20 Mar 2019,2019-03-20 00:00:00
Watch: Bulgarian Police Pepper Spray Themselves Instead Of Protestors,https://www.ndtv.com/offbeat/viral-video-bulgarian-police-pepper-spray-themselves-instead-of-protestors-2010169,20 Mar 2019,2019-03-20 00:00:00
J&K Teacher Arrested For Alleged Links With Terrorists Dies In Custody,https://www.ndtv.com/india-news/jammu-and-kashmir-teacher-arrested-for-alleged-links-with-terrorists-dies-in-custody-2009816,19 Mar 2019,2019-03-19 00:00:00
Paris Police Chief Sacked After Champs-Elysees Rioting,https://www.ndtv.com/world-news/paris-police-michel-delpuech-chief-sacked-after-champs-elysees-rioting-2009577,19 Mar 2019,2019-03-19 00:00:00
India Lodges Strong Protest With Pak Over Harassment Of Diplomats,https://www.ndtv.com/india-news/india-lodges-strong-protest-with-pak-over-harassment-of-high-commission-officials-2009545,19 Mar 2019,2019-03-19 00:00:00
"""Too Late"": Chirag Paswan Downplays Giriraj Singh Outburst Over Bihar Seat",https://www.ndtv.com/india-news/chirag-paswan-downplays-giriraj-singh-outburst-over-bihar-seat-2009438,18 Mar 2019,2019-03-18 00:00:00
Policeman Among 2 Dead In Clashes At Vedanta's Odisha Aluminium Plant,https://www.ndtv.com/india-news/1-dead-as-police-clash-with-protesters-at-vedantas-odisha-aluminium-plant-2009431,18 Mar 2019,2019-03-18 00:00:00
"Nun Who Protested Against Kerala Bishop Says Witnesses In ""Extreme Fear""",https://www.ndtv.com/kerala-news/nun-who-protested-against-bishop-franco-mulakkal-says-witnesses-in-extreme-fear-2008993,17 Mar 2019,2019-03-17 00:00:00
Former IAS Officer Shah Faesal Launches New Party In Kashmir,https://www.ndtv.com/india-news/shah-faesal-jammu-and-kashmir-peoples-movement-launched-by-former-ias-officer-2008903,17 Mar 2019,2019-03-17 00:00:00
16-Year-Old Girl Sets Herself Ablaze After Parents Fix Marriage,https://www.ndtv.com/cities/16-year-old-girl-sets-herself-ablaze-after-parents-fix-marriage-2008866,17 Mar 2019,2019-03-17 00:00:00
Indian-Americans Protest Against Pakistan For ''Sponsoring Terrorism'',https://www.ndtv.com/indians-abroad/indian-americans-protest-against-pakistan-for-sponsoring-terrorism-2008856,17 Mar 2019,2019-03-17 00:00:00
"Paris Luxury Stores Looted, Burned In ""Yellow Vest"" Riots",https://www.ndtv.com/world-news/paris-luxury-stores-looted-burned-in-yellow-vest-riots-2008739,17 Mar 2019,2019-03-17 00:00:00
Paris Stores Looted In New ''Yellow Vest'' Riots,https://www.ndtv.com/world-news/paris-stores-looted-in-new-yellow-vest-riots-2008689,16 Mar 2019,2019-03-16 00:00:00
"""Scrap The Tender"": Bengaluru Citizens Protest Against Elevated Corridor",https://www.ndtv.com/bangalore-news/bengaluru-protests-against-elevated-corridor-project-citizens-say-scrap-the-tender-2008676,16 Mar 2019,2019-03-16 00:00:00
Poll Panel Will Keep Delhi Police Out Of Probe Over Misleading Calls: AAP,https://www.ndtv.com/delhi-news/election-commission-ec-will-keep-delhi-police-out-of-probe-over-misleading-calls-aap-2008589,16 Mar 2019,2019-03-16 00:00:00
"Aam Aadmi Party Protests Outside Election Commission Over ""Illegal Raids""",https://www.ndtv.com/india-news/aam-aadmi-party-protests-outside-election-commission-over-illegal-raids-2008376,16 Mar 2019,2019-03-16 00:00:00
Vedanta's Sterlite Copper Appoints New CEO Amid Battle To Reopen Smelter,https://www.ndtv.com/india-news/vedantas-sterlite-copper-appoints-new-ceo-amid-battle-to-reopen-smelter-2008368,15 Mar 2019,2019-03-15 00:00:00
Nun Who Protested Against Franco Mulakkal Told To Leave Congregation,https://www.ndtv.com/kerala-news/nun-who-protested-against-franco-mulakkal-told-to-leave-congregation-2008348,15 Mar 2019,2019-03-15 00:00:00
"""Worse Than Voldemort"": Global Students' Strike Targets Climate Change",https://www.ndtv.com/world-news/worse-than-voldemort-global-students-strike-targets-climate-change-2008175,15 Mar 2019,2019-03-15 00:00:00
In Pics: Students In Delhi NCR Join 'Fridays For Future' Climate Change Protest,https://www.ndtv.com/offbeat/in-pics-students-in-delhi-ncr-join-fridays-for-future-climate-change-protest-2008020,15 Mar 2019,2019-03-15 00:00:00
"""Mission 150 Plus"": TDP Releases First List Of Candidates For Andhra Polls",https://www.ndtv.com/andhra-pradesh-news/tdp-releases-first-list-of-126-candidates-for-andhra-pradesh-assembly-polls-2007798,15 Mar 2019,2019-03-15 00:00:00
Call Centre Employees Hired To Inform About Voter Deletion Harassed: AAP,https://www.ndtv.com/india-news/call-centre-employees-hired-to-inform-about-voter-deletion-harassed-aap-2006707,13 Mar 2019,2019-03-13 00:00:00
"Hyderabad Woman Gang-Raped By Relatives, Children Were In Next Room: Cops",https://www.ndtv.com/hyderabad-news/relatives-gang-rape-woman-in-hyderabad-2005615,11 Mar 2019,2019-03-11 00:00:00
"Kashmir Papers Run Blank Front Page To Protest Move ""To Scuttle"" Media",https://www.ndtv.com/india-news/kashmir-dailies-leave-first-page-blank-as-mark-of-protest-2005580,11 Mar 2019,2019-03-11 00:00:00
"With Delhi Statehood Demand, AAP Launches Mega Election Campaign",https://www.ndtv.com/india-news/lok-sabha-elections-2019-with-delhi-statehood-demand-aap-launches-mega-election-campaign-2005483,10 Mar 2019,2019-03-10 00:00:00
Hundreds March In Paris As Childminders Join 'Yellow Vest' Protests,https://www.ndtv.com/world-news/hundreds-march-in-paris-as-childminders-join-yellow-vest-protests-2005476,10 Mar 2019,2019-03-10 00:00:00
"US Man Told Of Impending Death In ""Robotic"" Way Via Video Link",https://www.ndtv.com/world-news/us-man-told-of-impending-death-in-robotic-way-via-video-link-2005333,10 Mar 2019,2019-03-10 00:00:00
"Amid Chandigarh Ticket Tussle, Protest By Congress Workers On Women's Day",https://www.ndtv.com/chandigarh-news/on-womens-day-chandigarh-congress-leaders-protest-against-locked-office-2004908,08 Mar 2019,2019-03-08 00:00:00
"Strike, Protests Mark International Women's Day In Spain",https://www.ndtv.com/world-news/strike-protests-mark-international-womens-day-in-spain-2004809,08 Mar 2019,2019-03-08 00:00:00
"Day After ""Shoe Brawl"", BJP Lawmaker Seeks Action Against Cops",https://www.ndtv.com/india-news/day-after-shoe-brawl-bjp-lawmaker-seeks-action-against-cops-2004310,07 Mar 2019,2019-03-07 00:00:00
Congress' Student Wing Polishes Shoes To Protest Against Centre Over Jobs,https://www.ndtv.com/india-news/congress-student-wing-polishes-shoes-to-protest-against-centre-over-jobs-2003830,06 Mar 2019,2019-03-06 00:00:00
Protesting Farmers Call Off Amritsar-Delhi Railway Blockade After 2 Days,https://www.ndtv.com/india-news/protesting-farmers-call-off-amritsar-delhi-railway-blockade-after-2-days-2003627,06 Mar 2019,2019-03-06 00:00:00
"""Am I Carrying A Bomb In My Bag?"": IndiGo Offloads Kerala Man For Remark",https://www.ndtv.com/india-news/chennai-airport-indigo-offloads-kerala-man-boarding-cochin-bhubaneswar-indigo-flight-for-bomb-remark-2003496,06 Mar 2019,2019-03-06 00:00:00
AAP Leaders Hold Protest Against Punjab Minister,https://www.ndtv.com/india-news/aap-leaders-hold-protest-against-punjab-minister-2003143,05 Mar 2019,2019-03-05 00:00:00
"25 Trains Cancelled, 7 Diverted Over Farmers' Protests In Punjab",https://www.ndtv.com/india-news/25-trains-cancelled-7-diverted-over-farmers-protests-in-punjab-2002931,05 Mar 2019,2019-03-05 00:00:00
"Bharat Bandh Today Against Tribal Eviction Order, Anti-Reservation Policy",https://www.ndtv.com/india-news/bharat-bandh-5-march-2019-imapct-shutdown-against-tribal-eviction-order-anti-reservation-policy-2002916,05 Mar 2019,2019-03-05 00:00:00
"French Police Hit With Poo Bombs At ""Yellow Vest"" Protests",https://www.ndtv.com/world-news/french-police-hit-with-poo-bombs-at-yellow-vest-protests-2002540,04 Mar 2019,2019-03-04 00:00:00
Egyptian Photojournalist Released After More Than 5 years in prison,https://www.ndtv.com/world-news/egyptian-photojournalist-released-after-more-than-5-years-in-prison-2002480,04 Mar 2019,2019-03-04 00:00:00
NSUI Members Stop Metro To Reduce Fares For Students In Delhi,https://www.ndtv.com/delhi-news/nsui-members-stop-metro-to-demand-concession-in-fares-for-students-2002395,04 Mar 2019,2019-03-04 00:00:00
Indian-Americans Protest Outside UN Headquarters Against Pulwama Attack,https://www.ndtv.com/indians-abroad/indian-americans-protest-outside-un-headquarters-against-pulwama-attack-2002317,04 Mar 2019,2019-03-04 00:00:00
"Days After Tragedy, Retired CRPF Soldiers March In Capital For Pensions",https://www.ndtv.com/india-news/days-after-tragedy-retired-crpf-soldiers-march-in-capital-for-pensions-2002029,04 Mar 2019,2019-03-04 00:00:00
"France's ""Yellow Vest"" Protests March For 16th Straight Week",https://www.ndtv.com/world-news/frances-yellow-vest-protests-march-for-16th-straight-week-2001815,03 Mar 2019,2019-03-03 00:00:00
Kerala CPM Leader Denies Making 'Anti-National' Remark On IAF Strikes,https://www.ndtv.com/india-news/iaf-air-strikes-balakot-pakistan-kodiyeri-balakrishnan-of-kerala-cpm-denies-anti-national-remark-2001196,01 Mar 2019,2019-03-01 00:00:00
Man In Rape Case That Sparked Protests In Gujarat Jailed For 20 Years,https://www.ndtv.com/cities/man-in-rape-case-that-sparked-protests-in-gujarat-jailed-for-20-years-2000969,01 Mar 2019,2019-03-01 00:00:00
Doctors Protest Attack On Colleague By Patient's Family In Hyderabad,https://www.ndtv.com/hyderabad-news/doctors-protest-alleged-attack-on-colleague-by-patients-family-in-hyderabad-hospital-2000914,28 Feb 2019,2019-02-28 00:00:00
"Vatican Cleric, Guilty Of Sexually Abusing Boys, Removed From Top Post",https://www.ndtv.com/world-news/vatican-cleric-george-pell-guilty-of-sexually-abusing-boys-removed-from-top-post-1999846,27 Feb 2019,2019-02-27 00:00:00
"No Deaths In Police Firing During Protests, Says Arunachal Home Minister",https://www.ndtv.com/india-news/no-deaths-in-police-firing-during-protests-says-arunachal-home-minister-1999837,27 Feb 2019,2019-02-27 00:00:00
Farmers Go On Indefinite Strike In Noida Over Land Being Acquired,https://www.ndtv.com/noida-news/farmers-go-on-indefinite-strike-in-noida-over-land-being-acquired-1999825,27 Feb 2019,2019-02-27 00:00:00
Deaf Protesters End Stir In Pune After Government Concedes To Demands,https://www.ndtv.com/pune-news/deaf-protesters-end-stir-in-pune-after-government-concedes-to-demands-1999804,26 Feb 2019,2019-02-26 00:00:00
Just 43 Non-Lethal Bullets Used Before Sterlite Crackdown Killed 13: RTI,https://www.ndtv.com/india-news/just-43-non-lethal-bullets-used-before-sterlite-crackdown-killed-13-rti-1999318,26 Feb 2019,2019-02-26 00:00:00
"Deaf Protesters Baton-Charged In Pune, Chief Minister Seeks Report",https://www.ndtv.com/pune-news/deaf-protesters-baton-charged-in-pune-devendra-fadnavis-seeks-report-1999224,26 Feb 2019,2019-02-26 00:00:00
Arunachal Chief Minister Holds Peace Meet With Groups After Protests,https://www.ndtv.com/india-news/arunachal-chief-minister-pema-khandu-holds-peace-meet-with-groups-after-protests-1999204,25 Feb 2019,2019-02-25 00:00:00
"In Arunachal Tribal Protests, Kiren Rijiju Sees Communication Failure",https://www.ndtv.com/india-news/permanent-residency-issue-kiren-rijiju-rules-out-presidents-rule-in-arunachal-pradesh-after-days-of-1999147,25 Feb 2019,2019-02-25 00:00:00
"Arunchal Pradesh Chief Minister Blames ""Forces"" Behind Violent Protests",https://www.ndtv.com/india-news/arunchal-pradesh-chief-minister-pema-khandu-blames-forces-behind-violent-protests-1999140,25 Feb 2019,2019-02-25 00:00:00
Protests Erupt Outside Pakistan Embassy In Nepal To Condemn Pulwama Attack,https://www.ndtv.com/world-news/protest-erupt-outside-pakistan-embassy-in-nepal-to-condemn-pulwama-attack-1999099,25 Feb 2019,2019-02-25 00:00:00
Opposition Boycotts Maharashtra Governor's Address Over Remarks On RSS,https://www.ndtv.com/india-news/maharashtra-budget-session-opposition-boycotts-maharashtra-governors-address-over-remarks-on-rss-1998957,25 Feb 2019,2019-02-25 00:00:00
No Reports Of Violence In Arunachal Pradesh Today: Police,https://www.ndtv.com/india-news/no-reports-of-violence-in-arunachal-as-permanent-residency-move-scrapped-1998885,25 Feb 2019,2019-02-25 00:00:00
"Amid Clashes, Arunachal Pradesh Scraps Permanent Residency Move: 10 Facts",https://www.ndtv.com/india-news/arunachal-scraps-move-to-give-permanent-residency-status-to-two-tribes-from-outside-the-state-amid-c-1998584,24 Feb 2019,2019-02-24 00:00:00
"""For Life And Lung"": Gurugram Residents March To Save Aravalli Forests",https://www.ndtv.com/india-news/for-life-and-lung-gurugram-residents-march-to-save-aravalli-greens-1998569,24 Feb 2019,2019-02-24 00:00:00
Arunachal Deputy Chief Minister's Home Set On Fire As Protests Escalate,https://www.ndtv.com/india-news/arunachal-pradesh-violence-arunachal-deputy-chief-ministers-home-set-on-fire-as-protests-escalate-1998533,24 Feb 2019,2019-02-24 00:00:00
"In Arunachal Pradesh, 1 Killed, Deputy Chief Ministers House Under Attack: Highlights",https://www.ndtv.com/india-news/live-updates-in-arunachal-pradesh-1-killed-deputy-chief-minister-s-house-under-attack-1998521,24 Feb 2019,2019-02-24 00:00:00
"Day After Man's Death In Clashes With Police, Arunachal Capital Tense",https://www.ndtv.com/india-news/day-after-clashes-over-controversial-report-arunachal-capital-tense-1998317,23 Feb 2019,2019-02-23 00:00:00
"Clashes Break Out On Venezuela Border, Police Fire Tear Gas",https://www.ndtv.com/world-news/clashes-break-out-on-venezuela-border-police-fire-tear-gas-1998296,23 Feb 2019,2019-02-23 00:00:00
"""Absolutely Indian By Heart,"" Says Karachi Bakery After Protest In Bengaluru",https://www.ndtv.com/india-news/karachi-bakery-says-absolutely-indian-by-heart-day-after-protest-in-bengaluru-1998289,24 Feb 2019,2019-02-24 00:00:00
Rajnath Singh Appeals To People Of Arunachal Pradesh To Remain Calm,https://www.ndtv.com/india-news/rajnath-singh-appeals-to-people-of-arunachal-pradesh-to-remain-calm-maintain-peace-1998204,23 Feb 2019,2019-02-23 00:00:00
Microsoft Workers Protest Use of HoloLens Headsets for War,https://gadgets.ndtv.com/wearables/news/microsoft-workers-protest-use-of-hololens-headsets-for-war-1998070,23 Feb 2019,2019-02-23 00:00:00
Indians Protest In New York Against Pulwama Terror Attack,https://www.ndtv.com/indians-abroad/angry-indians-protest-in-new-york-against-pulwama-terror-attack-1998057,23 Feb 2019,2019-02-23 00:00:00
"""Kerala Government Cheated Crores Of Devotees"": Amit Shah On Sabarimala",https://www.ndtv.com/kerala-news/on-sabarimala-amit-shah-says-kerala-government-cheated-crores-of-devotees-1997998,23 Feb 2019,2019-02-23 00:00:00
Farmers End March To Mumbai After Talks With Maharashtra Government,https://www.ndtv.com/india-news/farmers-end-march-to-mumbai-after-talks-with-maharashtra-government-1997592,22 Feb 2019,2019-02-22 00:00:00
UNSC Pulwama Text Had India's Language Despite China's Protest: Sources,https://www.ndtv.com/india-news/pulwama-terror-attack-unsc-pulwama-text-had-indias-language-despite-chinas-protest-sources-1997516,22 Feb 2019,2019-02-22 00:00:00
"Manish Sisodia Says Delhi's Services Department Is ""Hampering"" Government",https://www.ndtv.com/delhi-news/manish-sisodia-says-delhi-services-department-is-hampering-government-1997433,22 Feb 2019,2019-02-22 00:00:00
Bengal Man Beaten To Death For Trying To Oppose Friends' Molestation,https://www.ndtv.com/india-news/bengal-man-beaten-to-death-for-trying-to-oppose-friends-molestation-1997399,21 Feb 2019,2019-02-21 00:00:00
"Minister Allegedly Slaps, Abuses Rajasthan Official, Colleagues Protest",https://www.ndtv.com/india-news/bundi-rajasthan-minister-ashok-chandana-allegedly-slaps-abuses-rajasthan-official-jp-meena-colleague-1996993,21 Feb 2019,2019-02-21 00:00:00
"Night Without Food, Shelter For Protesting Maharashtra Farmers: 10 Points",https://www.ndtv.com/india-news/50-000-farmers-participate-in-long-march-from-nashik-to-mumbai-alleging-governments-betrayal-1996924,21 Feb 2019,2019-02-21 00:00:00
"Will ""Donate A Kidney"" To Fund Street Lights: Delhi Congress Councillor",https://www.ndtv.com/delhi-news/aya-nagar-delhi-ved-pal-lohia-congress-councillor-will-donate-a-kidney-to-fund-street-lights-1996795,21 Feb 2019,2019-02-21 00:00:00
Photos Of Ex-Pakistani Cricketers Removed From Nagpur Stadium,https://sports.ndtv.com/cricket/photos-of-ex-pakistani-cricketers-removed-from-nagpur-stadium-1996735,20 Feb 2019,2019-02-20 00:00:00
"""Can Protest At PM House To Demand Statehood For Delhi"": Arvind Kejriwal",https://www.ndtv.com/india-news/can-protest-at-pm-modis-house-to-demand-statehood-for-delhi-arvind-kejriwal-1996730,20 Feb 2019,2019-02-20 00:00:00
"To Protest ""Betrayal"", 50,000 Maharashtra Farmers March To Mumbai Again",https://www.ndtv.com/india-news/alleging-betrayal-by-government-50-000-maharashtra-farmers-on-a-long-march-again-1996694,21 Feb 2019,2019-02-21 00:00:00
"3 UK Lawmakers Quit Party In Protest Over ""Disastrous Brexit""",https://www.ndtv.com/world-news/three-uk-conservatives-quit-party-in-protest-over-disastrous-brexit-1996625,20 Feb 2019,2019-02-20 00:00:00
"Kerala Women, Who Were Laid Off Abruptly, Take Part In Attukal Pongala",https://www.ndtv.com/kerala-news/attukal-pongal-kerala-women-employees-take-part-in-festival-outside-secretariat-1996540,20 Feb 2019,2019-02-20 00:00:00
22 Arrested As Cops Crackdown On Threats To Kashmiri Students In Dehradun,https://www.ndtv.com/cities/22-arrested-as-cops-crackdown-on-threats-to-kashmiri-students-in-dehradun-1996216,20 Feb 2019,2019-02-20 00:00:00
Teen In Lincoln Memorial Protest Sues Washington Post For $250 Million,https://www.ndtv.com/world-news/teen-nicholas-sandmann-in-lincoln-memorial-protest-sues-washington-post-for-250-million-1996185,20 Feb 2019,2019-02-20 00:00:00
"Week After Puducherry Crisis, A Truce Between Chief Minister, Lt Governor",https://www.ndtv.com/india-news/week-after-puducherry-crisis-truce-between-chief-minister-v-narayanasamy-lt-governor-kiran-bedi-1995628,19 Feb 2019,2019-02-19 00:00:00
Maharashtra To Move Planned Saudi Aramco Refinery After Farmers Protest,https://www.ndtv.com/india-news/maharashtra-to-move-planned-saudi-aramco-refinery-after-farmers-protest-1995509,19 Feb 2019,2019-02-19 00:00:00
Senior Punjab Cop Arrested Over Firing On Anti-Sacrilege Agitators,https://www.ndtv.com/cities/senior-punjab-cop-arrested-over-firing-on-anti-sacrilege-agitators-1995508,18 Feb 2019,2019-02-18 00:00:00
"Want To Meet The Pope, Says Kerala Nun Warned For Protests Against Bishop",https://www.ndtv.com/kerala-news/kerala-nun-sister-lucy-warned-for-protests-against-bishop-want-to-meet-the-pope-1995479,18 Feb 2019,2019-02-18 00:00:00
"Arvind Kejriwal Revives Statehood Demand For Delhi, Puducherry",https://www.ndtv.com/india-news/arvind-kejriwal-meets-v-narayansamy-revives-statehood-demand-for-delhi-puducherry-1995363,19 Feb 2019,2019-02-19 00:00:00
Protest-Hit Sterlite Plant In Tamil Nadu Will Stay Shut: Supreme Court,https://www.ndtv.com/india-news/sterlite-plant-in-tamil-nadu-closed-after-protests-last-year-over-alleged-pollution-will-stay-shut-s-1995114,18 Feb 2019,2019-02-18 00:00:00
Protests After Satirical Bengali Film Pulled Out Of Theatres Post Release,https://www.ndtv.com/kolkata-news/bhobishyoter-bhoot-protests-after-satirical-bengali-film-pulled-out-of-theatres-post-release-1995069,18 Feb 2019,2019-02-18 00:00:00
"Arvind Kejriwal To Meet Puducherry Chief Minister, On Sit-In, Today",https://www.ndtv.com/india-news/arvind-kejriwal-to-meet-v-narayanasamy-puducherry-chief-minister-on-dharna-today-1995029,18 Feb 2019,2019-02-18 00:00:00
"Candlelight Marches, Protests Across India To Condemn Pulwama Attack",https://www.ndtv.com/delhi-news/candlelight-marches-protests-across-india-to-condemn-pulwama-attack-1995017,18 Feb 2019,2019-02-18 00:00:00
"Pulwama Attack: Amitabh Bachchan, Others Voluntarily Stop Shoot As Film Bodies Protest",https://www.ndtv.com/entertainment/pulwama-attack-amitabh-bachchan-others-voluntarily-stop-shoot-as-film-bodies-protest-1994919,17 Feb 2019,2019-02-17 00:00:00
Iran Summons Pak Envoy After Suicide Bombing Kills 27 Near Its Border,https://www.ndtv.com/world-news/iran-summons-pak-envoy-after-suicide-bombing-kills-27-near-its-border-1994897,17 Feb 2019,2019-02-17 00:00:00
Country Stands By Its Jawans: West Bengal Chief Minister Mamata Banerjee,https://www.ndtv.com/india-news/country-stands-by-its-jawans-west-bengal-chief-minister-mamata-banerjee-1994761,17 Feb 2019,2019-02-17 00:00:00
French Police Fire Tear Gas As Latest 'Yellow Vest' Protests Turn Violent,https://www.ndtv.com/world-news/french-police-fire-tear-gas-as-latest-yellow-vest-protests-turn-violent-1994746,17 Feb 2019,2019-02-17 00:00:00
"Gujjars Call Off Quota Agitation After Assurance, Rajasthan Relieved",https://www.ndtv.com/india-news/gujjars-call-off-quota-agitation-after-assurance-rajasthan-relieved-1994626,16 Feb 2019,2019-02-16 00:00:00
"Puducherry Chief Minister ""Forced"" To Sleep On Road: Arvind Kejriwal",https://www.ndtv.com/india-news/arvind-kejriwal-airs-concern-over-puducherry-chief-minister-v-narayanasamy-being-forced-to-sleep-on-1994596,16 Feb 2019,2019-02-16 00:00:00
Kerala Nun Who Protested Against Rape Accused Bishop Gets Warning Letter,https://www.ndtv.com/kerala-news/kerala-nun-who-protested-against-rape-accused-bishop-franco-mulakkal-gets-warning-letter-1994563,16 Feb 2019,2019-02-16 00:00:00
"Pakistan Summons Indian Envoy, Rejects Claims Of Link To Pulwama Attack",https://www.ndtv.com/india-news/pulwama-terror-attack-pakistan-summons-indian-envoy-rejects-claims-of-link-to-pulwama-attack-1994384,15 Feb 2019,2019-02-15 00:00:00
"India Summons Pakistan Envoy, Strongly Protests Pulwama Terror Attack",https://www.ndtv.com/india-news/india-summons-pakistan-envoy-strongly-protests-pulwama-terror-attack-that-killed-40-soldiers-1994111,15 Feb 2019,2019-02-15 00:00:00
"Violent Protests In Jammu Over Pulwama Attack, Curfew On, Army On Standby",https://www.ndtv.com/india-news/pulwama-terror-attack-curfew-in-parts-of-jammu-after-violent-protests-1994081,15 Feb 2019,2019-02-15 00:00:00
Amazon Drops New York Headquarters Plan Amid Protests,https://www.ndtv.com/world-news/amazon-drops-new-york-headquarters-plan-amid-protests-1993871,15 Feb 2019,2019-02-15 00:00:00
Protests Continue In Kargil Over Centre's Ladakh Division Move,https://www.ndtv.com/india-news/protests-continue-in-kargil-over-centres-ladakh-division-move-1993757,14 Feb 2019,2019-02-14 00:00:00
SpaceX Protests NASA Launch Contract Awarded to Its Chief Rival,https://gadgets.ndtv.com/science/news/spacex-protests-nasa-launch-contract-awarded-to-its-chief-rival-1993648,14 Feb 2019,2019-02-14 00:00:00
