title,og_title,url,lang,content,publishedDate,dateObject,src
Manipur constable dies in police custody,Manipur constable dies in police custody,https://timesofindia.indiatimes.com/city/imphal/manipur-constable-dies-in-police-custody-govt-orders-magisterial-probe/articleshow/68660341.cms,en,"Representative image
Download The Times of India News App for Latest City
IMPHAL: A constable suspended for his “links” with a fugitive militant chief died in police custody on Saturday evening.Manjur Ahmed (34), from Yairipok Ningthoumanai in Thoubal district, was posted at the Imphal East Police reserve line. He was suspended on March 12 on charges that he was associated with militant leader Thokchom Nando.The rebel chief led the banned Kangleipak Communist Party (Mangal/Nando) and had been in jail since 2003 on several charges, including kidnapping and murdering the eight-year-old daughter of former minister Francis Ngajokpa. Last Tuesday, Nando escaped from the heavily guarded security ward of Jawaharlal Nehru Institute of Medical Sciences (JNIMS) in Imphal East, where he was undergoing treatment.“A day later, Ahmed was picked up by police. He died in custody on Saturday evening after being tortured during interrogation,” Ahmed’s brother Anwar Hussain said.The government has ordered a magisterial inquiry into his death. The district magistrate of Imphal East will conduct the inquiry into the circumstances leading to his death, a statement issued by the state home department said, setting a one-month deadline for submission of the report.Locals have set up a Joint Action Committee against Ahmed’s custodial death and made four demands — FIR against culprits, fitting punishment for them in 24 hours, CBI probe into the case and postmortem examination of Ahmed’s body within 24 hours in the presence of two members of the committee and the head of the JNIMS forensics department.If the government fails to meet these demands, the local pressure group has said, a mass meeting will be convened to discuss the next course of action.An Imphal court, meanwhile, reserving the conviction order in the murder case Nando has been accused of, has issued a non-bailable arrest warrant against him. Police have declared him a ‘wanted’ man and announced a cash reward of Rs 1 lakh for anyone who can provide information leading to his arrest.Ahmed’s is the third custodial death in Manipur in four months. In December, five policemen were suspended after an auto driver from Thoubal died in custody. In February, a villager at Keibul died in custody after being arrested by Keibul Police on charges of killing a wild boar. In both cases, locals said the detainees had been tortured to death.",06 May 2019,2019-05-06 09:27:35,timesofindia.indiatimes
National People’s Party worker beaten to death in Arunachal,National People’s Party worker beaten to death in Arunachal,https://www.eastmojo.com/arunachal-pradesh/2019/03/30/national-peoples-party-worker-beaten-to-death-in-arunachal,en,"Itanagar: A supporter of the state unit of National People’s Party (NPP) was allegedly beaten to death by unidentified miscreants at Kheti village in Arunachal Pradesh’s Tirap district on Friday night.
The deceased has been identified as Jaley Anna, a supporter of sitting MLA Tirong Aboh who is contesting the ensuing assembly elections from the Khonsa West seat as an NPP candidate.
Reportedly the miscreants also attacked another person namely Khamney Aboh who is at present admitted at the Assam Medical College and Hospital (AMCH) in Dibrugarh, Assam and is believed to be in a critical condition.
A statement released from the state unit of NPP on Saturday said that a group of unidentified people entered the houses of Anna and Aboh in Kheti Village at around 9.30 pm and took the duo away with them to some distance far from the village.
“The miscreants thrashed them badly and later dropped them near the village at around 10.30 pm. The villagers took the duo to the district hospital, however, Anna succumbed to his injuries after some time,” NPP state vice president Nima Sangey Saling said in a statement.
Saling said that Anna mentioned the name of one Eli Ketok before his last breath. Ketok who also lives in Kheti village is allegedly a member of the NSCN (IM), a banned underground outfit. “Anna succumbed to the merciless beating by Eli Ketok of NSCN (IM) and his group. The condition of Aboh is also critical,” Saling said.
Following the incident, an FIR has been lodged at Khonsa Police Station by Chathien Anna, wife of late Anna and NPP district president Naklam Besai.
Tirap deputy commissioner P N Thungon and superintendent of police J Meena, when contacted, refused to comment on the matter saying “the case was under investigation”.
Strongly condemning the incident, the NPP has meanwhile, called upon all the political parties of the State to not get involved with any kind of underground elements during the electoral politics.
“We should try to gain the sympathy of the people through our hard work and connect with the ones at grass root level with a clear vision of development peace and harmony. Peace in the society is the key to bring about all round development in the state,” the party said.",30 Mar 2019,2019-03-30 14:26:43,eastmojo
Row erupts as fashion show at Jamia Millia Islamia nixed,Row erupts as fashion show at Jamia Millia Islamia nixed,https://timesofindia.indiatimes.com/city/delhi/row-erupts-as-fashion-show-at-jamia-nixed/articleshow/68678733.cms,en,"Jamia Millia Islamia
Download The Times of India News App for Latest City
NEW DELHI: A fashion show in the engineering department of Jamia Millia Islamia was cancelled due to opposition from certain students of the department who called it “immoral” and “un-Islamic”. Now, many in Jamia have come out to oppose the “intolerant and radical elements”.Students alleged that the event was opposed by a 12-member ‘Students of Jamia’ group, an organisation known for its religious sermons and programmes on the campus in collaboration with vice-president of AAP’s students’ wing, CYSS. They said such incidents bring disrepute to the university.Sadaf Nasar, a tourism management master’s student, said, “Already Jamia has been stereotyped for its minority character. Incidents like these strengthen the stereotypes that Jamia is regressive and that students don’t follow any democratic ethos.”The fashion show ‘Tarz-e-Libas’ was to be part of the ‘Xtacy’ fest held on March 30. But before the event could start, a group of 12 men came and disrupted it holding placards that read: “Fashion shows are against the very idea of Jamia”.Mohammad Arshad Warsi, one of the protesters, claimed “Jamia has a certain ‘tehzeeb’ or culture and events like fashion shows are not part of it”.Aqdas Sami, a prominent student leader who is also the Delhi vice-president of AAP’s students’ wing CYSS, supported the protest. “Such events create disruption in the university and are not part of Jamia’s ethos,” he told TOI. He claimed the incident was being blown out of proportion but couldn’t explain why there were no protests in the past for other fashion shows on campus.CYSS Delhi general secretary Hariom Prabhakar said, “Our outfit is not against any fashion show but only against the objectification of women.”But the organisers had a different story to tell. “We were threatened by these students who acted like they were guardians of faith and of Jamia’s culture. The university has seen several such fashion events in the past but there was never any such protest. They wanted to make a political statement and created a scene at the venue,” said an organising team member on condition of anonymity.The student added, “The Jamia administration was backing us to go ahead with the event but we decided to cancel it due to security reasons.” Ahmed Azeem, the media coordinator of Jamia, said the university is looking into the incident.",06 May 2019,2019-05-06 11:55:48,timesofindia.indiatimes
Farmers on warpath across state,Farmers on warpath across state,https://www.tribuneindia.com/news/punjab/farmers-on-warpath-across-state/750287.html,,"With polls nearing, they want parties to commit to fulfilling their demands
Ruchika M Khanna
Tribune News Service
Chandigarh, March 29
Restive farmers in Punjab have launched agitations across the state, forcing all political parties in the fray for the May 19 General Election to sit up and take note.
Their agitation, launched just as the poll scene begins, is likely to force political parties — the ruling Congress, SAD-BJP, AAP and Punjab Democratic Alliance to commit to fulfilling some of their demands.
While the Opposition parties — both SAD- BJP and AAP — have been extending their support to the farmers, the latter are venting their ire against the ruling Congress, for most of their troubles, be it a complete loan waiver or farmers being forced to give blank cheques as security for loans. But they are equally blaming the Centre (BJP-led NDA government of which the Akali Dal is a constituent) for the rise in costs of all farm inputs, poor remuneration of crops and not implementing the recommendations of the Swaminathan Commission report.
“The agitations launched now are not in favour of or against any political party. We only want each party to commit that they will take up our cause if voted to power,” said Satnam Singh Pannu of Kisan Mazdor Sangharsh Committee. Beginning today, he is leading a “Jail Bharo Andolan”, wherein 51 farmers will court arrest everyday in Amritsar, Tarn Taran, Ferozepur, Gurdaspur and Jalandhar. Other than this, seven other farmer organisations, led by the Bhartiya Kisan Union (Ekta Ugrahan), are protesting outside banks each day, demanding that the blank cheques taken from indebted farmers “illegally” be returned to them. These organisations will also be holding a protest from May 2 to 4 in Patiala (hometown of Chief minister Capt Amarinder Singh, from where his wife Preneet Kaur is seeking to contest the polls) against the inability of the state government to give a complete loan waiver to farmers.
Other than this, though the cane growers, who protested against the non-payment of their dues by the sugar mill at Dhuri for 20 days, have ended their stir, these farmers have stated that they will re-launch their agitation from April 2, in case their dues (as promised by the administration on March 26, when the dharna was lifted) are not cleared. Today, a case was registered against 100 of these protesting farmers for locking the SDM and other officers in their office, when the agitation was on earlier this week. This has led to widespread condemnation by almost all farmer organisations and they have extended their full support to the farmers against whom case is being registered.
“First, the government held back the dues for cane given by farmers to sugar mills. They protested for 20 days and no payment was released. Only when in desperation these farmers took an extreme action of locking officers, the government promised to release their dues. This means that the government had money, but were not willing to release it to us,” rued Sukhdev Singh Kokrikalan, general secretary of the BKU (Ekta Ugrahan), adding that this time they would force each political party in fray to announce and commit to the promises made for farmers.
‘Jail Bharo Andolan’ begins today",20 Mar 2019,2019-03-20 00:00:00,tribuneindia
Gunmen shoot shopkeeper in Jammu and Kashmir's Tral,Gunmen shoot shopkeeper in Jammu and Kashmir's Tral,https://timesofindia.indiatimes.com/city/srinagar/gunmen-shoot-shopkeeper-in-jammu-and-kashmirs-tral/articleshow/68629625.cms,en,"Picture used for representational purpose only
Download The Times of India News App for Latest City
SRINAGAR: Unidentified gunmen shot and injured a shopkeeper on Thursday in Jammu and Kashmir 's Pulwama district on Thursday evening, police said.Muzafar Ahmad Hajam was attacked in Midoora village of Tral area of Pulwama ""The injured shopkeeper has been shifted to Srinagar for specialized treatment. The area is being searched,"" a police officer said.",06 May 2019,2019-05-06 10:27:16,timesofindia.indiatimes
INTUC seeks increase in wages,INTUC seeks increase in wages,https://www.tribuneindia.com/news/ludhiana/intuc-seeks-increase-in-wages/750540.html,,"Ludhiana, March 29
Members of the Indian National Trade Union Congress (INTUC) staged a protest outside the office of the Labour Department at Gill Road in Ludhiana on Friday.
The dharna was organised under the guidance of INTUC’s district council president Swaran Singh.
General secretary of INTUC, Ludhiana, Suresh Sood, said labourers were being exploited as the government failed to pay attention towards them.
He said the government should increase minimum wages of the factory workers at the earliest as it was difficult for them to meet daily needs due to low income. — TNS",30 Mar 2019,2019-03-30 07:49:00,tribuneindia
Namma Metro’s Rs 50 minimum balance rule is anti-poor: Passengers,Namma Metro’s Rs 50 minimum balance rule is anti-poor: Passengers,https://timesofindia.indiatimes.com/city/bengaluru/namma-metros-rs-50-minimum-balance-rule-is-anti-poor-passengers/articleshow/68635054.cms,en,"Namma metro users protesting against the Bangalore Metro Rail Corporation (BMRCL)'s decision to fix Rs 50 mini... Read More
‘Unfair to punish majority for fault of a few’
Download The Times of India News App for Latest City
BENGALURU: Opposing the Bangalore Metro Rail Corporation’s (BMRCL) decision to fix Rs 50 as minimum balance in smartcards, several Metro users on Friday staged a protest near Town Hall Most of the protesters were youngsters who had connected through social media and had no backing of any political party or NGO. They waved posters and shouted slogans against the new rule.The BMRCL on Wednesday increased minimum balance in smartcards to Rs 50 from the previous Rs 8.50.Slamming the BMRCL for taking autocratic decisions without consulting passengers, they demanded the management roll back the decision. “The BMRCL management has taken a unilateral decision by fixing a minimum balance of Rs 50. This will make it even more difficult for lower income people to use the Metro. If a passenger wants to travel short distance, why should he or she pay Rs 50 in advance,” asked Krushika AC, who led the campaign.“I was surprised when they implemented this new rule without even informing passengers in advance. It’s a big amount for daily wage workers, but they are aware that commuters do not have alternatives. In fact, the management was unwilling to listen to our problems,” he added.Muthuraj, another user, said: “They claim to be ‘Namma Metro’ but they do not seem to practise it. They want only affluent people to use the service. We don’t need Rs 50 in smartcards to travel in Metros like Delhi or Chennai, then why in Bengaluru?”“There is no rationale behind this decision. Why should someone keep Rs 50 when they already paid the same amount while purchasing a card? Will they further increase the minimum charge once they expands their network,” asked Guru Prasad DN also a commuter.In two hours, the group collected over 300 signatures from Sampige Road Metro station on a memorandum they plan to give to BMRCL. “We will intensify the protest if they don’t withdraw the decision,” they said.Namma Metro’s average daily ridership is around 4 lakh. Of this, about 62% (2.3 lakh) are smartcard users. The corporation made Rs 50 mandatory in smartcards after several users with low balance allegedly got into arguments with staff at exit gates, claiming they had no money to pay the excess fare. BMRCL officials say there are 10-12 such commuters a day, which, however, translates to a minuscule proportion of the total users.Sharanya GS, a regular passenger, said: “Those misusing the card should be made to surrender the card on exit if there is no balance or cash. Defaulters can later make the payment and reclaim the cards. Anyway, Metro authorities will have to refund Rs 50 when we surrender our cards.” Another passenger Sanjiv S said: “It’s unfair to punish majority of the passengers for the fault of a few fraudsters.”",06 May 2019,2019-05-06 09:26:38,timesofindia.indiatimes
Ranam film-shoot tragedy: Victims’ family stages protest,Ranam film-shoot tragedy: Victims’ family stages protest,https://www.thehindu.com/news/cities/bangalore/film-shoot-tragedy-victims-family-stages-protest/article26696624.ece,en,"Relatives of 29-year-old Sumera and her five-year-old daughter Ahera, who were killed during the shooting of Kannada film Ranam at Mahadeva Kodigehalli village, staged a protest in front of the Bagalur police station on Friday, demanding immediate arrest of those responsible for the fatal blast.
Also Read Ranam producer, director among those named in FIR
“It has been three days since the incident and the police are yet to make any arrests. The film crew had taken neither permission for the shooting nor any precautionary measures. This led to the loss of two lives,” said Tabrez Khan, Sumera’s husband.
‘Negligence’
Munawwar Khan, a relative of the victims, said it was a case of clear negligence on part of the film crew, but so far, no one from the Karnataka Film Chamber of Commerce had offered any consolation to the family.
The protesters demanded that the police speed up the investigation and said they would continue to protest till arrests were made. However, senior police officers spoke to the protesters and convinced them to end the agitation. They assured them that the probe was on and that arrests would be made soon.
Meanwhile, Zainab, 8, who sustained multiple injuries in the accident, is recovering at a private hospital.
Ranam is being produced by Kanakapura Srinivas and stars Chiranjeevi Sarja and Chetan. The film crew was shooting a car explosion scene at the Bengaluru Aerospace Park SEZ, Bagalur, on the city’s outskirts on Friday evening. Mr. Tabrez, along with his family, was heading to Soolibele to a relative’s house in a car when he noticed the road blocked because of the shoot.
The family members got down to watch the action. Sumera, Ahera, and Zainab stood behind a film mobile van, parked near the spot where the car was set to explode. Multiple compressor cannons had been placed under an SUV. The cannons, when fired, were to propel the car into the air. However, when they were fired, one of the cannons — a 3.5-ft metallic cylinder — flew across the road with high velocity and hit the bystanders, killing Ahera and Sumera. Residents of a nearby village claimed that members of the film unit, instead of attending to the victims, fled from the scene, abandoning everything in a matter of minutes. It was the villagers from Mahadeva Kodigehalli who helped shift the injured Zainab to a hospital.
Based on the complaint filed by Mr. Tabrez, the Bagalur police have registered an FIR against Shrinivas R., the producer, R.S. Production, director Samudram V., production manager Kiran, stunt manager Vijayan and his technical team, charging them under Section 304 (culpable homicide not amounting to murder) and Section 338 (causing grievous hurt by act endangering life or personal safety of others) of the IPC and under various sections of the Explosive Substances Act, 1908.
Special team formed
Kala Krishnaswamy, DCP (North-East) said a special team has been formed to track down the accused, who are on the run. “We have some clues that they might have fled to Hyderabad and Chennai. Efforts are on to track them down,” she said.",01 Apr 2019,2019-04-01 01:31:39,thehindu
"Jammu Migrants continue protest, demand relief at par with Kashmiris","Jammu Migrants continue protest, demand relief at par with Kashmiris",https://www.dailyexcelsior.com/jammu-migrants-continue-protest-demand-relief-at-par-with-kashmiris/,en,"Excelsior Correspondent
JAMMU, Mar 27: Welfare Committee Jammu Migrants continued their protest today outside the office of Relief Commissioner at Canal Road here.
The protest was led by Committee President Wali Mohammad Khan, wherein the Jammu Migrants demanded relief and ration on the pattern of Kashmiri migrants.
The committee added that the migrants of the district were living in miserable conditions and suffered a lot but the authorities were not serious about the issue.
Wali Mohammad Khan demanded bifurcation of ration cards, inclusion of new born babies, release of balance arrears from 2008 to 2015, issuance of State Subject and RBA category certificate, 10 litres kerosene oil and cash assistance of Rs 300 per cattle per month to family, consideration of special package of Jammu Migrants including township and employment package, new data form for maintenance of proper records, timely issuance of ration and relief and cash assistance to 17 families registered as migrants who have been ignored and are deprived of cash and ration.
“We have been approaching the Relief Organizations at regular intervals but in vain,” Wali Mohammad Khan said and demanded relief and ration at par with Kashmiri migrants.",27 Mar 2019,2019-03-27 21:38:39,dailyexcelsior
"In midnight shooting, BJP worker killed in Bengal; 3rd death in a fortnight","In midnight shooting, BJP worker killed in Bengal; 3rd death in a fortnight",https://www.hindustantimes.com/india-news/in-midnight-shooting-bjp-worker-killed-in-bengal-3rd-death-in-a-fortnight/story-QlPVbvgjXQHaWri4GY386O.html,en,"A Bharatiya Janata Party (BJP) worker was shot dead allegedly by Trinamool-backed miscreants on Wednesday night.
The incident triggered a roadblock by BJP supporters in Harishchandrapur area of Malda district, about 405 km away from Kolkata.
According to the complaint filed with the police, Patanu Mondal (28) was sleeping with his wife and eight-month-old daughter when a few men entered the house and opened fire.
“We have received a complaint of murder against two persons, but they are on the run. Central paramilitary personnel will conduct route march in the area to restore confidence among the locals before the election,” said a senior police officer of the Malda district.
Incidentally, Mondal became the third person to be killed in political clashes in West Bengal since the elections were announced on March 10. On March 12, a 28-year-old Congress worker was killed in Chopra of North Dinajpur district. On March 18, a 45-year-old Trinamool worker was hacked to death in Murshidabad district.
On Thursday morning, BJP supporters staged an agitation in the area and prevented the police from taking away Patanu Mondal’s body for autopsy.
The murder triggered a blame game.
“Mondal used to work as a civic police volunteer for Harishchandrapur police station. Earlier, Trinamool workers framed him in a false case and he lost his job. Thereafter, he became a BJP leader in the area and a couple of days ago he was instrumental in organising a rally in the area where more than 1,000 people gathered, unnerving the ruling party workers. Trinamool-backed goons have killed Mondal,” alleged Malda district BJP president Sanjit Mishra.
Mishra also said that in 2018, Patanu’s elder brother Utpal won a gram panchayat seat on a BJP ticket in the Doulatnagar gram panchayat (where the family lives).
“Since that victory last year, the family has been facing pressure from local Trinamool leaders. After Utpal’s victory, Trinamool workers set fire to his (Utpal’s) house and damaged the jute that he cultivated. Ruling party workers were also putting pressure on Patanu to join the Trinamool,” added Mishra.
Dismissing the BJP leader’s claim, the working president of Trinamool’s Malda district, Dulal Sarkar, said, “The brother of the victim, Utpal, has already joined the Trinamool, and has been appointed the pradhan of local gram panchayat. Inspired by the development spree of the state government, Patanu, too, was also planning to join the Trinamool. BJP-backed goons killed him because of this.”
Mishra said the assailants fired four rounds and a bullet pierced Mondal’s neck.
In her complaint, the victim’s wife, Ruma Das Mondal, alleged that she was woken up by the sound of gunfire and saw two persons exiting the room. She named Sumit Mondal, a resident of the village, as one of the two. But she could not recognise the other assailant.
“A few days ago, Sumit threatened my father that he would kill my husband,” alleged Ruma Das Mondal.
First Published: Mar 28, 2019 17:29 IST",28 Mar 2019,2019-03-28 17:29:32,hindustantimes
