title,og_title,url,lang,content,publishedDate,dateObject,src
‘Militants’ who attacked police in Srinagar arrested,‘Militants’ who attacked police in Srinagar arrested,https://www.deccanherald.com/national/militants-who-attacked-police-in-srinagar-arrested-731099.html,,"Jammu and Kashmir Police Sunday claimed to have arrested two militants, who allegedly carried out an attack on Chanapora Police Post in Srinagar that left a cop injured, two days back.
A police spokesperson said the arrests were made after hectic efforts by the police. “The militants identified as Mushtaq Ahmad Rather and Junaid Ahmad Dar were arrested from Wathoora area of Chadoora in Budgam today (Sunday) morning,” he said and claimed to have recovered some arms and ammunition, including pistol from their possession.
The attack on the police post at Chanapora in Srinagar was carried on Friday evening resulting in injuries to one policeman constable Feroz Ahmad, who is now undergoing treatment at SKIMS Soura.
Al-Umar Mujahideen militant outfit had claimed responsibility for the attack.",28 Apr 2019,2019-04-28 00:00:00,deccanherald
Former Puri Municipality chairman's nephew stabbed by miscreants,Former Puri Municipality chairman's nephew stabbed by miscreants,https://odishatv.in/crime/former-puri-municipality-chairmans-nephew-stabbed-by-miscreants-351051,en,"Puri: A youth sustained critical injuries after he was attacked with a knife by unidentified miscreants near Badadanda in Puri on Sunday. The youth has been identified as Nikhil Sarangi, nephew of former chairman of Puri Municipality, Jayant Sarangi.
Nikhil was initially admitted to Puri Sadar hospital and later shifted to a private hospital in Bhubaneswar after his condition deteriorated.
The incident occurred yesterday night when Nikhil was in Badadanda area. The miscreants reportedly stabbed Nikhil and fled the spot.
Though the exact reason behind the attack is yet to be ascertained, police have started an investigation into the matter.",04 Feb 2019,2019-02-04 19:00:03,odishatv.in
Three Myanmar workers injured in Samut Sakhon shooting,Three Myanmar workers injured in Samut Sakhon shooting,http://www.nationmultimedia.com/detail/breakingnews/30364707,en,"There they found three Myanmar men with bullet wounds in a room on the second floor. They were rushed to Mahachai Hospital.
Police have yet to identify the injured workers.
Witnesses told police that the gunmen are two Thai men who fled in a pickup truck after the shooting.
Witnesses said the three worked as porters at a fresh market in Mahachai. Their friends said they had a quarrel with a group of Thai men four days ago and one of the Myanmar workers was so badly beaten he had to be sent to hospital.
Pol Lt Col Pongsiri Kengnok, deputy commander of the Mahachai police station, said police learned that one of the attackers is a pork vendor at the fresh market. Police would seek an arrest warrant against him soon, Pongsiri added.",01 Jan 1970,1970-01-01 00:33:39,nationmultimedia
"Suspected Muslim rebels storm Thai temple, kill 2 monks","Suspected Muslim rebels storm Thai temple, kill 2 monks",https://www.apnews.com/578928ab6d534cb6ab4fc278a152015a,,"HAT YAI, Thailand (AP) — Gunmen presumed to be Muslim insurgents stormed a Buddhist temple in southern Thailand, killing two monks and wounding two others, police said Saturday.
The Friday night attack in Narathiwat province was the latest in a recent upsurge of violence in the area, which since 2004 has been plagued by a separatist insurgency that has claimed about 7,000 lives. Narathiwat is one of Thailand’s three southernmost provinces, the only ones with Muslim majorities in the Buddhist-dominated country.
Witnesses described seeing armed men arrive at the temple on motorcycles, open fire with automatic weapons and then storm inside where they shot the monks in their quarters, according to Thai news report. One of those killed was the temple’s abbot.
The temple attack was one of several violent incidents in Narathiwat on Friday, including a roadside bombing that wounded five members of security forces, and a shootout between paramilitary rangers and five armed men that left one of the gunmen dead. The others escaped.
The attacks have occurred during an effort to revitalize peace talks between the Thai government and some insurgent groups, and may be an effort to scuttle them by stoking popular outrage and inviting heavy handed retaliation. Analysts say the most militant group, the Barisan Revolusi Nasional, BRN, is not taking part in the talks.
The New York-based group Human Rights Watch has pinned the blame for the ongoing violence on the BRN.
“The ghastly attack on Buddhist monks by insurgents in Thailand’s deep south is morally reprehensible and a war crime, and those responsible should be held to account,” said Brad Adams, Asia director at Human Rights Watch. “The insurgents’ 15-year campaign of deliberately attacking Buddhist and Muslim civilians can’t be justified.”
The watchdog said that since the insurgency flared up in January 2004, BRN’s members have targeted Buddhist temples and monks because they consider them emblematic of the Thai Buddhist state’s “occupation” of ethnic Malay Muslim territory. At least 23 monks have been killed and more than 20 wounded, it said.
The insurgents have also targeted security personnel assigned to provide monks safe passage to and from the temples, it said.
Buddhist temples often serve as community centers, and monks are revered in Thailand. There is fear that attacks on temples could trigger vigilante action by Buddhist civilians against Muslims.
“This is a very brazen act to drive a wedge among people,” Pornpen Khongkachonkiet, a human rights defender, told The Associated Press. “The cause of the conflict in the south is originally between the government and locals. But this is an attempt to turn the conflict to be between two religions,” she added.
She said there are victims on both sides, noting that on Jan. 11, an Imam — a Muslim community leader — was gunned down. A lack of transparency in the judicial system makes it difficult to assign blame for the violence, said Pornpen, who also heads the Cross Cultural Foundation, which monitors and documents cases of torture and ill-treatment.
Prime Minister Prayuth Chan-ocha condemned the violence and ordered security officers to find the culprits, said government spokesman Puttipong Punnakanta.",19 Jan 2019,2019-01-19 07:44:24,apnews
Southern insurgency: Ranger shot dead in Songkhla house,Southern insurgency: Ranger shot dead in Songkhla house,https://thethaiger.com/news/south/southern-insurgency-ranger-shot-dead-in-songkhla-house,,"FILE PHOTO: The latest shooting in a spate of recent violence in the southern provinces – The Nation
A ranger based in Yala has been shot dead at his home in Songkhla’s Muang district.
Pol Capt Adirek Burintrapibal, the deputy inspector of Muang Songkhla police station, was alerted at 8.30pm last night of the shooting at a house in Moo 10 village in Tambon Pawong.
The Nation reports that 43 year old Charoen Moraphan died when a bullet hit him in the left side of his chest. His wife, Khiew, says she was at the back of the house while Charoen was watching TV in the living room facing towards the front door. She says her husband was on leave from his Yala ranger base for two weeks. Police claim a gunman inserted a gun barrel through the front door and opened fire at Charoen, hitting him once in the chest. Police are yet to identify the motive for the killing, the latest in a spate of violence in the southern provinces.
. Or .",18 Feb 2019,2019-02-18 07:49:40,thethaiger
"2 killed, 2 wounded in Narathiwat gun attack","2 killed, 2 wounded in Narathiwat gun attack",https://www.bangkokpost.com/news/security/1536806/2-killed-2-wounded-in-narathiwat-gun-attack,,"NARATHIWAT: Two village defence volunteers were killed and two others wounded in a gun attack by a group of gunmen in tambon Chang Phuak of Chanae district on Saturday afternoon.
Pol Lt Adipong Promnu, a Chanae police investigator, said that according to eyewitnesses, at about 5.20pm approximately five armed men emerged from roadside bushes and opened fire at house No 281 and a sentry box near a building used as the village's learning centre.
Four village defence volunteers, two men and two women, were hit by gunshots. One of them, Mrs Uab Uthai, the house owner, was killed instantly in front of the house. The three others -- Siboonruang Uthai, Wanpen Uthai and Boonlert Chotchoi -- were injured.
Siboonruang died shortly afterwards. The two others were admitted to Sungai Kolok Hospital.
The gunshots also damaged a Toyota Yaris car parked in front of the learning centre.
The gunmen then set fire to a pick-up truck before fleeing the scene.
Police were investigating. It was initially believed the attack was the work of separatists.",09 Sep 2018,2018-09-09 09:41:00,bangkokpost
Two villagers slain in Pattani,Two villagers slain in Pattani,https://www.bangkokpost.com/news/crime/1626882/two-villagers-slain-in-pattani,,"The scene of the shooting in Sai Buri district of Pattani. (Photo by Abdullah Banjakat)
PATTANI: Two villagers were killed in two separate gun attacks in Nong Chik and Sai Buri districts on Sunday morning, police said.
The first incident happened at about 4.30am at Village Group 7 of tambon Pulo Puyo in Nong Chik district when Arong Wamata-u, 30, was riding home on a motorcycle with a nephew riding pillion.
They were followed by two men on another motorcycle and at one point the pillion-riding gunman opened fire, hitting Arong twice in the body, seriously wounding him. Arong was rushed to Nong Chik Hospital where he was pronounced dead.
In Sai Buri district, a villager was found lying dead on a rural road near Village Group 5 in tambon Lahan at about 7.30am. He was identified as Paosee Lateh, 40, a construction worker.
A police investigation revealed that Paosee was leaving his home on a motorcycle, heading for the village, when he was fired at by two men on another motorcycle. He was hit twice -- once in the head and the other time in the body.
Pol Maj Gen Piyawat Chalermsri, the Pattani police chief, said an investigation is underway to establish whether the two incidents were related to the southern insurgency or due to personal conflicts.",10 Feb 2019,2019-02-10 00:00:00,bangkokpost
‘This torture has features of racism’: Police use snake to interrogate Papuan,‘This torture has features of racism’: Police use snake to interrogate Papuan,https://www.thejakartapost.com/news/2019/02/09/this-torture-has-features-of-racism-police-use-snake-to-interrogate-papuan.html,en,"The Papua Police have apologized for wrapping a snake around a native Papuan they suspected of theft.
A video of the incident, which took place while the police were interrogating the suspect, has been circulating online.
The officers involved in the incident are currently being investigated for ethical violations, said Papua Police spokesman Ahmad Mustofa Kamal. ""We apologize for that incident,"" he said in a statement on Friday, as quoted by kompas.com.
Jannus P. Siregar, who heads the Papua Police's internal affairs division (Propam), said the officers were using the snake to intimidate the suspect so that he would confess to the crime.
The incident reportedly took place in Wamena, Jayawijaya.
Jayawijaya Police chief Adj. Sr. Comr. Tonny Ananda Swadaya promised that his men would work professionally. “We have taken action against the officers who did the misconduct. We are moving them to other places,” he said.
The video has sparked criticism from netizens.
Human rights lawyer Veronika Koman wrote on her Twitter account @VeronikaKoman that the suspect should be presumed innocent until proven otherwise and should not be tortured to admit to a crime, regardless of whether the charges leveled against him were true.
“Given the context of the persecution in Papua, this torture has features of racism,” she wrote.
Some locals, however, appeared to support the police’s actions.
Hengki Heselo, a leader in Jayawijaya regency, said the community supported the police’s stern measures to curb crime, including the use of snakes to threaten suspected criminals.
""We have felt the effects of recent police actions. The number of drunk people who carry machetes is decreasing,"" he said as quoted by kompas.com. (das)",09 Feb 2019,2019-02-09 00:00:00,thejakartapost
Corruption investigators assaulted while tailing Papua governor,Corruption investigators assaulted while tailing Papua governor,https://www.radionz.co.nz/international/pacific-news/381790/corruption-investigators-assaulted-while-tailing-papua-governor,en,"Indonesian corruption investigators have been assaulted while tailing Papua Governor Lukas Enembe.
Photo: Victor Mambor
Indonesian state media reported the two officials were hospitalised prompting an inquiry from Jakarta police.
The officials from the Corruption Eradication Commission (KPK) were assaulted close to midnight on Saturday.
The incident, which took place at a hotel in Jakarta, happened while Papua Governor Lukas Enembe was meeting with Papuan officials.
Speaker of the Papua Provincial Council Yunus Yonda told Antara News that Papuan officials caught the KPK members taking photos of Mr Enembe.
They were hospitalised with facial injuries but it was unclear who was responsible.
A Jakarta police spokesperson told the Jakara Post Mr Enembe was being probed and not formally investigated.",05 Feb 2019,2019-02-05 14:46:41,radionz.co.nz
Thousands of Muslims gather in Monas to pray for Indonesia,Thousands of Muslims gather in Monas to pray for Indonesia,https://en.republika.co.id/berita/en/islam-in-archipelago/19/02/22/pnbk7u414-thousands-of-muslims-gather-in-monas-to-pray-for-indonesia,,"Munajat 212 is held at Monas area, Jakarta, on Thursday night (Feb 21).
REPUBLIKA.CO.ID, JAKARTA -- Thousands of Muslim worshipers gathered in the National Monument (Monas) Square here on Thursday evening to seek the mercy of almighty Allah Subhanahu Wata'ala for Indonesia ahead of this year's general elections. They came from Jakarta and other cities to attend the event, which was organized by the Indonesian Ulema Council (MUI)-Jakarta Chapter along with several other Islamic organizations, by highlighting the theme of ""212 Evening of Prayer"" or Munajat 212.
The Muslim men and women flocked to the Monas Square in Central Jakarta a few hours before the Maghrib prayer was performed in congregation. With the guidance of ulemas sitting on a stage, the crowd started the event's agenda by performing compulsory Maghrib (sunset) followed by Isha (evening) prayers in congregation, as well as chanting praises to Allah.
Munajat 212 participants perform compulsory Maghrib (sunset) followed by Isha (evening) prayers in congregation, as well as chanting praises to Allah, Thursday (Feb 21) evening.
They also recited and sang ""Shalawat"" (religious chants for praising Prophet Muhammad (Peace Be Upon Him) in an endeavor to ""knock the gates of sky."" This religious gathering was also filled with prayer for the safety of Habib Rizieq Shihab.
Habib Rizieq is widely known as a respected ulema and the founder of the Islamic Defenders Front (FPI). He is currently staying in the Holy city of Mecca with his family, and the crowds of attendees prayed for his return to Indonesia.
The gathering was not only attended by ordinary Muslim worshipers but also by many influential figures in the country, including Amien Rais (one of the Reform Movement leaders), Fahri Hamzah, and Fadli Zon (outspoken legislators). Speaker of the People's Consultative Assembly (MPR) Zulkifli Hasan, MPR's former speaker Hidayat Nur Wahid, FPI leader Sobri Lubis, and the daughter of Indonesia's second president Soeharto, Titiek Soeharto were also seen among the attendees.
In his brief speech, Lubis asked the crowd to pray for the safety of several Muslim figures who remained in prison, including Buni Yani and Ahmad Dhani. He also criticized what he called an act of injustice in law enforcement, as observed in the Habib Bahar bin Smith case.
Meanwhile, MPR Speaker Zulkifli Hasan underlined the importance of conducting fair, peaceful, and democratic parliamentary and presidential elections for Indonesia's better future.
In securing the gathering, at least 12 thousand security personnel were deployed. They consisted of those from the Jakarta Metropolitan Police, Indonesian Military, and the Jakarta Provincial Government.",22 Feb 2019,2019-02-22 15:43:06,en.republika.co.id
24 Men Charged Over Assault on Bangkok Temple School,24 Men Charged Over Assault on Bangkok Temple School,http://www.khaosodenglish.com/news/crimecourtscalamity/crime-crime/2019/02/26/24-men-charged-over-assault-on-bangkok-temple-school/,en,"BANGKOK — Multiple charges have now been brought against two dozen men accused of raiding a Bangkok school during university admission tests, police said Tuesday.
A total of 24 suspects, all male, have now been charged with six counts including trespassing, vandalism, assault, intimidation and consuming alcohol on temple grounds following Sunday’s attack on the Matthayom Wat Sing School, according to the Bang Khun Thian district police chief.
One suspect was charged with sexually harassing a minor, Col. Luesak Damnoensawas said. It followed complaints from a student who said one of the men kissed her cheek and verbally harassed her while she tried to break up a fight between them and her friend.
Investigators today raided the homes of 16 suspects for drugs and weapons but said they came up empty-handed.
Dozens of men stormed the campus Sunday afternoon and assaulted guards, students and teachers in classrooms after the school asked that an ordination ceremony at the temple be quiet as university admission tests were being administered to more than 300 students.
A teacher said he was assaulted by multiple men and sustained serious injuries to his arm after being hit by a chair and table. A student said he was struck in the head. The school’s director said some men charged into his office and punched him.
The ringleader was identified by police as Wallop Nutfaeng, 32, who apologized in tears to students, teachers and school security guards during a police raid on his house.
He said he wanted to talk to the school’s director and got angry when he couldn’t find him. He also admitted to being drunk.
﻿﻿﻿
Security footage shows the men walk through the school’s front gate, some holding liquor bottles, and start attacking the school guards attempting to stop them almost immediately. Wallop was seen leading the group.
Police said 20 men will be held at the Thon Buri Criminal Court, while the four minors would be sent to a local juvenile detention center. They said three more suspects would be called in for questioning.
The court on Tuesday afternoon denied bail for all suspects, saying they pose a threat to witnesses and could disrupt the investigation.
The attack drew outrage from the public. The police commissioner has promised swift prosecution of the assailants, while junta leader Prayuth Chan-ocha joined the public to condemn the incident online and command that all perpetrators be “dealt with seriously and urgently.”
Education officials said affected students can retake the tests next week. The Education Minister said Monday that they were looking into whether they would sue the attackers for the cost of rescheduling the tests.
Related stories:
Students Affected by School Raid to Retake Test Next Week
Temple Goers Asked to Lower Noise Level Vandalize School",26 Feb 2019,2019-02-26 05:33:17,khaosodenglish
Kurukshetra University Students on Indefinite Hunger Strike Against Rustication of 19 Students,Kurukshetra University Students on Indefinite Hunger Strike Against Rustication of 19 Students,https://www.newsclick.in/kurukshetra-university-students-indefinite-hunger-strike-against-rustication-19-students,en,"On March 17, nineteen students were rusticated from Kurukshetra University, Haryana, for protesting against the lack of basic facilities in the university. The affected students are members of the Joint Students’ Struggle Committee, a body comprising of members of the campus’ students’ organisations. Some of the rusticated students have been restricted from entering the university campus indefinitely, while a few have been restricted only for the current session.
The students were rusticated for participating in an agitation that was held on February 28. The agitation was organised to protest against the increase in mess fees, poor quality of food in the mess, and to demand conducting of the backlog examinations within three months of result. This is when the Joint Students’ Struggle Committee (JSSC) was formed by the students’ organisations active in the campus.
The Committee consists of students from Students’ Federation of India (SFI), Chhatra Ekta Manch, Disha Chhatra Sangathan, and other students’ organisations. Convener of the Joint Students’ Struggle Committee, Vinod Gill, told NewsClick, “Our movement against the administration lasted for exactly one month and five days.”
During the agitation on February 28, the police had detained 44 students. They were released later in the day. The Students’ Struggle committee protested against this move, following which the administration met the students, and agreed to most of their demands. They said that a committee will be formed to look into the issues being faced by the students. The VC was also present at the meeting. However, soon after this, the rustication order was given to 19 students.
Seven out of the nineteen rusticated students started an indefinite hunger strike on March 26, demanding immediate roll back of the rustication order. Sumit Singh, one of the rusticated students, who is also the Haryana State Vice President of SFI, told NewsClick, “The students have their final examinations coming up, and instead of preparing for the exams, they have been forced to come out on the street for their rights.”
Also Read: JNU Along With Other Universities Vows to Oust Modi in 2019 Elections
Suman, State President of SFI, told NewsClick, “The Vice Chancellor was the All India President of ABVP. He is clearly a right-winger, and has problems with SFI members. That is why he rusticated us, along with others for raising slogans against him. It is not our fault, we were the ones fighting for our rights. It is the VC who refused to meet us and listen to our demands, and instead, rusticated us.”
Eight days after the hunger strike started, several of the protesters have been hospitalised. Jyoti, one of the students sitting on the hunger strike is in a critical condition, as her health deteriorated rapidly.
Singh said, “The parents of the protesting students have been called. Several parents visited the campus to talk to the administration. The Proctorial Board has agreed to hold a meeting tomorrow to determine the fate of the rusticated students. The protest will not be stopped until the rustication is rolled back.”
Also Read: JNU Students on Indefinite Hunger Strike Demanding Revocation of Prospectus",06 Apr 2019,2019-04-06 00:00:00,newsclick.in
Brahmapuram plant to resume operations,Brahmapuram plant to resume operations,https://www.thehindu.com/news/cities/Kochi/brahmapuram-plant-to-resume-operations/article26413751.ece,en,"The solid waste treatment plant of the Kochi Corporation at Brahmapuram will resume operations on Saturday, District Collector K. Mohammed Y. Safirulla has said.
Security at the plant will be strengthened in the wake of frequent fire breakouts, and the district administration and the corporation have already taken measures in this regard, Mr. Safirulla said after a meeting between the Mayor and the Vadavucode-Puthencruz panchayat authorities he had convened on Friday.
The panchayat has launched protest against the alleged negligence of the civic body in properly maintaining the plant. Residents had blocked garbage-laden vehicles headed for the plant on Thursday night. As part of enhancing security, nine additional employees have been appointed. Besides, 10 CCTVs, including two high-definition ones, will be mounted at various points by March 5. Three motor pumps will be installed. One pump is already in place for drawing water from the nearby waterbody to the plant in the event of an emergency.
The dysfunctional leachate plant will be restored. Garbage dumped on the plant premises will be rearranged into smaller heaps facilitating the movement and access of fire tenders during emergencies. More lights will be installed.
The police have been directed to seize open top vehicles and those found leaking used for transporting waste. Cameras will be installed at the septage treatment plant. The Collector will visit the plant and hold a review meeting next week.
Temporary measures meant for operating the existing plant till the commissioning of the proposed waste-to-energy plant, expected in 15 months, are being taken. Mayor Soumini Jain said steps would be taken to restrict the flow of plastic to the plant and ban plastic kits.
Sheela Devi, Deputy Collector, Disaster Management; P.M. Velayudhan, president, Vadavucode -Puthencruz panchayat; panchayat members, and corporation councillors attended the meeting.",02 Mar 2019,2019-03-02 01:17:42,thehindu
