title,og_title,url,lang,content,publishedDate,dateObject,src
"Goa bandh today; State, police geared up to maintain law and order","Goa bandh today; State, police geared up to maintain law and order",https://www.heraldgoa.in/Goa/Goa-bandh-today-State-police-geared-up-to-maintain-law-and-order-/143175.html,en,"GMPF leader says bandh will be peaceful; Mining dependents to hold bike rally
Team Herald Team Herald
PONDA: The State administration and Goa Police are gearing up to maintain law and order on account of the Goa bandh call given by Goa Mining People’s Front (GMPF) in six talukas of the mining belt on February 26. PONDA: The State administration and Goa Police are gearing up to maintain law and order on account of the Goa bandh call given by Goa Mining People’s Front (GMPF) in six talukas of the mining belt on February 26.
It is learnt that the mining dependents will not only move with black flags in protest against non-resumption of mining but hoist the same atop their houses so that they stay till mining commences. It is learnt that the mining dependents will not only move with black flags in protest against non-resumption of mining but hoist the same atop their houses so that they stay till mining commences.
GMPF delegation led Puthi Gaonkar was invited to meet South Goa Collector, SP and other State administration officials with regards to the bandh scheduled on Tuesday. GMPF delegation led Puthi Gaonkar was invited to meet South Goa Collector, SP and other State administration officials with regards to the bandh scheduled on Tuesday.
Gaonkar also met Ponda police officials and informed Herald that the bandh would be peaceful. Gaonkar also met Ponda police officials and informed Herald that the bandh would be peaceful.
GMPF leader assured the bandh call is voluntary and a bike rally will be organised. He claimed that the government has taken precaution and adequate police staff would be deployed to prevent any law and order situation. GMPF leader assured the bandh call is voluntary and a bike rally will be organised. He claimed that the government has taken precaution and adequate police staff would be deployed to prevent any law and order situation.
It may be recalled that, following the mining closure, last year the mining dependents carried out a huge morcha in Panjim, which later turned violent. The Administration is making every effort to ensure that no such incident takes place. It may be recalled that, following the mining closure, last year the mining dependents carried out a huge morcha in Panjim, which later turned violent. The Administration is making every effort to ensure that no such incident takes place.
While the bandh will be held from 8 pm to 5 pm, the rally of mining dependents will be organised in two parts starting from 9 am onwards. It will be held in Assonora and Sanguem in and will commence and conclude at Usgao Tisk at around 1 pm. While the bandh will be held from 8 pm to 5 pm, the rally of mining dependents will be organised in two parts starting from 9 am onwards. It will be held in Assonora and Sanguem in and will commence and conclude at Usgao Tisk at around 1 pm.
The rally at Assonora will start at 9 am and later proceed to Bicholim, Sanquelim, Honda, Surla, Dignem, Pali, Usgao and Usgao Tisk. The rally at Assonora will start at 9 am and later proceed to Bicholim, Sanquelim, Honda, Surla, Dignem, Pali, Usgao and Usgao Tisk.
In South, the rally will start at two places namely Sanguem and Quepem and will meet at Ambedkar Circle Curchorem and proceed to Sanvordem, Curchorem, Dharbandora and Usgao Tisk. South Goa Collector and South Goa SP have assured to inform their North Goa counterparts and the concerned administrative officials from both districts. In South, the rally will start at two places namely Sanguem and Quepem and will meet at Ambedkar Circle Curchorem and proceed to Sanvordem, Curchorem, Dharbandora and Usgao Tisk. South Goa Collector and South Goa SP have assured to inform their North Goa counterparts and the concerned administrative officials from both districts.
The State administration has ordered that there should not be intentional traffic blockade and against causing inconvenience to school children during the bandh or rally. The State administration has ordered that there should not be intentional traffic blockade and against causing inconvenience to school children during the bandh or rally.
--",06 May 2019,2019-05-06 00:00:00,heraldgoa.in
Adarsh teachers protest,Adarsh teachers protest,https://www.tribuneindia.com/news/punjab/adarsh-teachers-protest/738108.html,,"Tribune News Service
Sangrur, March 4
Without salaries for the last more than five months, teachers of Adarsh schools of Sangrur, Barnala districts today staged a protest in front of the president of a private society that runs their schools in Gurdaspura village of Sangrur.
“Teachers have been without salaries for the last five months and they also have other issues. I have directed Raovinder Singh, who is the president of the Shaheed Udham Singh Education and Welfare Society, Sangrur, to solve all problems of teacher before March 15. Teachers lifted their protest after meeting me,” said Avikesh Gupta, SDM, Sangrur.",05 Mar 2019,2019-03-05 06:44:00,tribuneindia
Work on Abohar bypass resumes,Work on Abohar bypass resumes,https://www.tribuneindia.com/news/punjab/work-on-abohar-bypass-resumes/745222.html,,"THE TRIBUNE IMPACT
Raj Sadosh
Abohar, March 18
The Public Works Department has resumed work to widen the city bypass linking the Fazilka-Abohar-Malout stretch of the national highway that was suspended a few months ago.
The Tribune had last month highlighted that the work started in December 2016 has not been completed yet.
PWD Minister Vijay Inder Singla had told The Tribune in the last week of February that the Punjab Water Supply and Sewerage Board could not get work completed within the stipulated time. “We took up the release of pending funds in the first week of February with the Centre. As soon as funds are received, the pending work will be expedited,” Singla had assured.
The minister on May 16, 2018, had suspended some officials and chargesheeted two of them after samples taken from the bypass failed quality test. The minister along with Hussan Lal, secretary, Public Works Department, and a quality control team had inspected the work on the bypass on May 14 last year. The team had taken samples of bitumen and tiles laid on the central divider. It was found that most tiles had developed cracks within 10 days. It was observed that no cement mortar was used to place the tiles. Two samples were found to be substandard and fell in the rejected category.
Business activities had nosedived due to suspended construction work and residents of the colonies located on both sides had to bear with blockages in waste water disposal.
Residents and businessmen on Monday distributed sweets as work was resumed by the contractors.",20 Mar 2019,2019-03-20 00:00:00,tribuneindia
Farm workers protest govt policies,Farm workers protest govt policies,https://www.tribuneindia.com/news/ludhiana/farm-workers-protest-govt-policies/735450.html,,"Tribune News Service
Ludhiana, February 26
Members of the Khet Mazdoor Sabha staged a protest outside the Deputy Commissioner’s office on Tuesday against the policies of both Central and state government. They demanded from the government to improve their conditions.
Gulzar Sing Goria, general secretary of the organization, said the government should fulfil the promises made with labourers.
He said the government should increase wages of the labourers. He demanded implementation of the Social Security Act 2008 at the earliest.
“Due to the wrong policies of the Central government, the labourers are forced to suffer a lot. The MGNREGA budget has been reduced. Besides, labourers have not got their pending wages for the past five months,” he said.
Kulwant Singh Hunjan of the organisation said the Punjab Government must allot plots and provide grant of Rs 3 lakh each for construction of house to homeless people.",20 Feb 2019,2019-02-20 00:00:00,tribuneindia
Non-teaching staff of PAU up in arms over demands,Non-teaching staff of PAU up in arms over demands,https://www.tribuneindia.com/news/ludhiana/non-teaching-staff-of-pau-up-in-arms-over-demands/764500.html,,"Tribune News Service
Ludhiana, April 26
The PAU Employees Union, along with PAU Class Four Workers Union, held a protest in front of Thapar Hall today. The rally was staged as start of an agitation against the authorities of the Punjab Agricultural University for the unfulfilment of demands of the non-teaching employees.
The main demands of the employees are to reduce the experience period for promotion of technical staff, to increase the number of posts of car/jeep drivers’ supervisors, regularisation of the contractual employees without any written test, to settle the pending cases with the committee of line of promotion, to manage the problems being faced by employees in the Local Audit and to restore the promotions of eligible employees which have been stopped by the authorities without any valid reason.
Baldev Singh Walia, president of PAU Employees Union, said the authorities of the university were not fulfilling certain genuine demands of the non-teaching staff. He further stated if these demands were not met soon, the agitation would take an ugly shape.",20 Apr 2019,2019-04-20 00:00:00,tribuneindia
DU teachers protest at Sonia's home over 4-yr undergraduate programme,DU teachers protest at Sonia's home over 4-yr undergraduate programme,https://www.news18.com/news/india/du-protest-4-610222.html,,"University of Delhi teachers and students marched to Congress President Sonia Gandhi's residence on Sunday morning. They were protesting against the four-year undergraduate programme that is being introduced by the university.Around 150 members of various teacher and student organisations protested at 12 Janpath as police barricaded the route to Sonia's residence at 10 Janpath where they had earlier decided to stage the protest. The protesters, comprising of members from AISF, AISA, SFI, Campus Front of India and DUTA, demanded the resignation of DU Vice Chancellor Dinesh Singh, saying the shift to the four-year pattern was ""hurriedly implemented"".They also alleged that the four-year programme was against the interest of students coming from weaker section, especially those belonging to SC, ST and OBC. The protest near Sonia's residence comes after several delegations of teachers and students have raised the isssuewith Prime Minister Manmohan Singh and HRD minister Pallam Raju. ""We have met HRD minister Pallam Raju and Prime Minister Manmohan Singh but did not get any favourable response from them. Now we are at the doorsteps of Sonia Gandhi,"" said Udit Raj, chairman, All India Confederation of SC/ST Organisations.Raj said, ""if Sonia too does not take any step to scrap the four year programme then we will stage an even bigger protest which can also turn violent."" The Dalit activist said students coming from weaker sections, especially those belonging to SC, ST and OBC would, face difficulties pursuing the new programme as they would not be able to meet the expenditure of an additional year. ""The four-year course will only mean that the students from the socially and economically backward classes will get marginalised. They are trying to make education elitist. Only the elite will be able to do this four-year course,"" he said.""Dinesh Singh is behaving as an autocrat and has entered into the domain of HRD ministry. Their are 600 universities in India and if every university came up with their owneducational policy then what will be the result,"" Raj alleged. Teachers from the university added that the stress on English and Mathematics in the foundation course will discourage students.They also claimed that the new structure is being adopted on the lines of American higher education system to make way for foreign universities in India. Although the protesting teachers and students were not allowed to stage their demonstration on 10 Janpath, a delegation of five members submitted a memorandum at the reception of Gandhi's residence.The new four-year undergraduate programme, to be introduced from this year's academic session, has been in controversy ever since a section of teachers and students objected to its ""hurried implantation"". Left leaders, including Sitaram Yechury, have taken the issue to the doorsteps of the Prime Minister.",05 May 2019,2019-05-05 00:00:00,news18
Locals and business operators protest luxury condo in Kata Noi,Locals and business operators protest luxury condo in Kata Noi,https://thethaiger.com/news/phuket/locals-and-business-operators-protest-luxury-condo-in-kata-noi,,"PHOTO: Kata Rocks. A premier view and top spot to catch the nightly sunset.
The island of Phuket, with its dramatic east and west coast clifftops, means there is an abundance of ocean-facing rooftop bars and restaurants where you can enjoy a perfectly chilled beverage while taking in the beautiful scenery. There are so many great locations to catch the sunset on the island it is very difficult to choose the ten “best” (we could rattle off 20 without blinking) so apologies to other worthy contenders who might be on the list in the future.
Here is, in no particular order, our Phuket Top Ten Sunset Bars on the island of Phuket….
1 Rang Hill Restaurants
Rang Hill is a popular hangout for locals especially and located on the north side of Phuket Town. It has stunning views over island. There are a number of restaurants and bars located on the hill offering local dishes and their most famous specialty is ice coffees. The most popular at Khao Rang Breeze Restaurant and Tunk Ka.
They call it a hill, but it’s actually only 150 metres high which is not so tall at all, however the views are amazing even at the low height. There’s also an excellent viewpoint to catch your postcard view of Phuket Town and the south of the island beyond.
2 360 Degrees at The Pavilions Resort
As the name suggests 360 Degrees at The Pavilions Resort has uninterrupted panoramic views of Layan and Laguna. 360 is a magical spot with fairy lights in the trees, has excellent service, delicious tapas and mouth watering cocktails. It opens just in time for sunset at 5.30 pm and a place where we love to sit in the lounge chairs and take it all in. Don’t miss the ‘Bubbles and Beats’ with The Thaiger 102.75 FM’s Garry Holden there on Thursday and Saturday nights. An absolute must for any visitor or resident in Phuket.
3 On Top at Swissotel Resort Phuket Patong Beach
An oasis in the middle of the madness in Patong, On Top is located on the 7th floor of the Swissotel Resort Phuket Patong Beach. More recently it has established itself as a cool vibe for in house guests and locals, happy hours and live DJs add to the ambience not to mention the million dollar views, prior to this it was more popular for events and private parties.
4 Escape Rooftop Bar at Novotel Phuket Karon Resort & Spa
The newest member to the rooftop bar club, Escape, at the Novotel Karon opened late in November 2017 with an extensive cocktail list, and to keep the munchies away an equally impressive tapas and antipasto selection. Open daily from 6pm Escape has a rustic feel with varying specials throughout the week, including “Double Trouble” on Tuesday (buy one get one free on selected drinks) and “Treasure Box” on a Thursday where you have keys to a lucky draw treasure box with many different prizes and deals.
5 The Kee Sky Lounge
Located in the heart of Patong on the rooftop of The Kee Resort, The Sky Lounge has an enticing vibe with DJs and daily happy hours. Unlike many bars the happy hour is from 5.30pm – 8.30pm with classic cocktails as well as their signature cocktails all just 150 baht, locals beers 100 baht and house wines 150 baht. Whether your looking to dance the night away or spend a quiet romantic evening with your loved one The Kee Sky Lounge is a great place to do both.
6 Kata Rocks
Set on the edge of the resorts stunning floating swimming pool with unparalleled views of the Andaman Sea, Kata Rocks Bar is chic in design with funky creative cocktails paired with sumptuous tapas. The impressive team of mixologists create unique and left of the middle cocktails that are not found anywhere on the island, the resort itself has its own branded Gin which features in many of the drinks list. My personal favourite is their Lycheetini which is crisp short drink made from vodka, lychee, lime juice and a dash of palm sugar, problem is I can’t just have the one! Try their non-alcoholic home-made ginger beer too.
7 Wassa Homemade Bar
They say a picture paints a thousand words, don’t be fold by the plastic chairs and rustic tables at Wassa Homemade Bar, though ascetically underwhelming, the drinks list and to-die-for views are very impressive. Placed at the top of Phuket Hill facing perfectly West for sublime sunsets Wassa is a local hangout and also for expats in the know. Like any locally owned and operated bar the Thai menu accompanying the drinks is tasty and cheap as.
8 Vanilla Sky at Cape Sienna
The relaunch of Vanilla Sky Bar & Gastro Pub at Cape Sienna is a welcome back to the ultra cool rooftop bar to the Phuket scene. It is positioned perfectly on the cliffs of Kamala’s Nakalay Bay to take in the stunning Phuket sunsets. With daily happy hour specials from 5-6pm, occasional guest DJ spots and delicious Gastro Pub dishes, Vanilla Sky Bar is an institution for locals, tourists and expats. With stunning sea views, creative craft cocktails, modern stylish Gastro Pub food it is a fabulous place to hang with friends, say hi to Pepe the resorts F&B Director a good guy and always up for a chat.
9 Baba Pool / Nest at Sri Panwa
Sri Panwa Resort at the very bottom of Cape Panwa has the rare 360 degree ocean views around Phuket. The award winning Baba Pool Club and Baba Nest has lounge chairs positioned and sunken in the mirrored splash pool the colours alone during sunset are fabulous. High end cocktails matched with a high end prices, Baba is a cool hangout with friends and family but perhaps just for a special occasion.
10 Talung Thai at Paresa Resort
Located on the ‘Millionaires Mile’ in Kamala, Talung Thai at Paresa Resort has dramatic high cliff views over the Andaman Sea with like so many West coast properties, amazing sunsets. You are welcomed to the bar with floor to ceiling wine fridges that immediately say ‘wow’, the drinks list is award winning and their mixologists have competed year on year at the Thailand best of the bests Diegeo cocktail competitions. Monthly cocktails specials and as well as the resorts signature cocktails keep you going back for more. My personal favourite is the Thai inspired ‘Chilli and Lime Caipiroska’ the perfect combination of spice and sour.",25 Feb 2019,2019-02-25 04:42:22,thethaiger
Court rejects challenge to Batang Toru dam,Court rejects challenge to Batang Toru dam,https://www.thejakartapost.com/news/2019/03/04/court-rejects-challenge-to-batang-toru-dam.html,en,"The Medan State Administrative Court in North Sumatra has rejected a lawsuit filed by environmental group the Indonesian Forum for the Environment (Walhi) against North Sumatra administration’s decision to issue permits for a hydropower project in the Batang Toru ecosystem.
Environmentalists and activists have urged that the project, which is costing Rp 22 trillion (US$1.5 billion), be scrapped because of its potential impact on the environment, especially on the critically endangered Tapanuli orangutans that live in and around the ecosystem.
The judges said the issuance of the permit, as well as a revised environmental impact analysis (amdal) document for the project, had passed the proper legal procedures and were in line with existing regulations.
“The judges reject every part of the plaintiff’s lawsuit,” presiding judge Jimmy C. Pardede said, reading the ruling during Monday’s hearing.
In the lawsuit, Walhi argued that the permit issuance was problematic given the lack of discussion and participation from locals, as well as potential ecological problems caused by the hydropower dam. The location of the site is also prone to earthquakes, the group argued.
During previous hearings, local residents testified in the courtroom that the company had never informed them about the project.
Judge Selvie Ruthyaroodh, however, said during Monday’s hearing that the bench regarded such testimonies as irrelevant to the case, because the residents lived in Batang Toru district rather than Marancar district, where the dam would be constructed.
Walhi lawyer Padian Adi Siregar lamented the judges’ ruling. The residents who testified, he said, would also be affected by the project, as they lived downstream of the river used by the Batang Toru hydropower plant.
The court also rejected expert testimony submitted by the plaintiff that the location of the project is on an active tectonic fault. The judges argued there were no restrictions on building a structure in the area.
Selvie added that the bench believed there had been sufficient studies on the project’s effects on animals living around the dam, including the Tapanuli orangutan, and it was satisfied mitigation measures were in place.
Walhi, however, questioned this assertion as the company had not provided such studies as evidence during the hearings.
The Tapanuli orangutans, whose frizzier coats differentiate them from their Bornean and Sumatran counterparts, are threatened by poaching and illegal logging. The International Union for Conservation of Nature (IUCN) has included the species on its red list, classing it ""critically endangered"" as scientists have only recorded 800 of the species living in nature.
“We will file an appeal and take any other remaining legal measures available,” Walhi’s North Sumatra office director, Dana Prima Tarigan, said. He added that the verdict did not reflect justice or fairness for the environment.
Apart from the lawsuit, Walhi was also involved in a protest on March 1 with an international network of activists against Bank of China, one of several international banks funding the project. The environmental group demanded the bank take concrete action by stopping its funding of the project because of its potential threat to the environment.
“Walhi believes this project is not in line with China’s Belt and Road Initiative promoted by President Xi Jinping, as the project won’t provide mutual benefit as promised by the Chinese government,” the group wrote in a statement.
PT NSHE senior executive for external relations, Firman Taufick, lauded the court verdict, saying the company could now focus more on the construction of the power plant. The project, which will produce 510 megawatts of electricity for North Sumatra, has been touted as “environmentally friendly”.
“PT NSHE asks for every element [of society] to support the construction of the power plant as it will provide clean electricity for the province,” Firman said in a press briefing in Medan on Monday. He also asked all experts and academics to work together with the company to draft tangible programs to conserve the Batang Toru ecosystem.",22 Oct 2018,2018-10-22 00:00:00,thejakartapost
